<?xml version="1.0" encoding="UTF-8"?>
<xs:schema xmlns:xs="http://www.w3.org/2001/XMLSchema"
	targetNamespace="http://www.uncertweb.org/sta/wps/parameter" xmlns:par="http://www.uncertweb.org/sta/wps/parameter"
	elementFormDefault="qualified">
	<xs:element name="parameters">
		<xs:complexType>
			<xs:sequence>
				<xs:element minOccurs="1" maxOccurs="unbounded" name="parameter">
					<xs:complexType>
						<xs:attribute name="key" type="xs:string" use="required" />
						<xs:attribute name="value" type="xs:string" use="required" />
					</xs:complexType>
				</xs:element>
			</xs:sequence>
		</xs:complexType>
	</xs:element>
</xs:schema>	
	
