<?xml version="1.0" encoding="UTF-8"?>
<par:parameters xmlns:par="http://www.uncertweb.org/sta/wps/parameter"
	xmlns:xsi="http://www.w3.org/2001/XMLSchema-instance"
	xsi:schemaLocation="http://www.uncertweb.org/sta/wps/parameter parameter.xsd ">
	<par:parameter key="adsf" value="sadfasdf" />
	<par:parameter key="adsf" value="sadfasdf" />
	<par:parameter key="adsf" value="sadfasdf" />
	<par:parameter key="adsf" value="sadfasdf" />
	<par:parameter key="adsf" value="sadfasdf" />
	<par:parameter key="adsf" value="sadfasdf" />
	<par:parameter key="adsf" value="sadfasdf" />
	<par:parameter key="adsf" value="sadfasdf" />
	<par:parameter key="adsf" value="sadfasdf" />
	<par:parameter key="adsf" value="sadfasdf" />
	<par:parameter key="adsf" value="sadfasdf" />
	<par:parameter key="adsf" value="sadfasdf" />
	<par:parameter key="adsf" value="sadfasdf" />
	<par:parameter key="adsf" value="sadfasdf" />
	<par:parameter key="adsf" value="sadfasdf" />
	<par:parameter key="adsf" value="sadfasdf" />
</par:parameters>
